{
  "$schema": "http://json-schema.org/draft-07/schema#",
  "$id": "https://copybook-rs.effortlessmetrics.com/schemas/security-receipt-v2.0.json",
  "title": "copybook-rs Normalized Security Evidence v2",
  "description": "Closed shape contract for deterministic normalized cargo-audit evidence. The weekly workflow publishes security-receipt-v2-{workflow-run-id} alongside cargo-audit-raw-{workflow-run-id}; the normalized document is generated from and linked to the exact raw bytes, semantically validated, schema-validated, and uploaded with 90-day retention. JSON Schema validation alone does not prove aggregate parity; consumers must also run validate_receipt or an equivalent semantic validator. This is not a security certification or regulatory-compliance determination.",
  "type": "object",
  "required": [
    "schema_version",
    "receipt_id",
    "identity",
    "scanner",
    "outcome",
    "findings"
  ],
  "properties": {
    "schema_version": {
      "const": "2.0"
    },
    "receipt_id": {
      "type": "string",
      "pattern": "^sha256:[0-9a-f]{64}$",
      "description": "Deterministic SHA-256 identifier for the explicit scan, raw-audit digest, and scanner tuple; it is not authentication or a digest of the normalized outcome and findings."
    },
    "identity": {
      "type": "object",
      "required": [
        "commit_sha",
        "scan_type",
        "workflow_run_id",
        "raw_audit_sha256"
      ],
      "properties": {
        "commit_sha": {
          "type": "string",
          "pattern": "^[0-9a-f]{40}$"
        },
        "scan_type": {
          "type": "string",
          "enum": ["pr-gate", "weekly-scan", "manual"]
        },
        "workflow_run_id": {
          "type": "string",
          "minLength": 1
        },
        "raw_audit_sha256": {
          "type": "string",
          "pattern": "^[0-9a-f]{64}$"
        }
      },
      "additionalProperties": false
    },
    "scanner": {
      "type": "object",
      "required": ["name", "version", "exit_code"],
      "properties": {
        "name": {
          "const": "cargo-audit"
        },
        "version": {
          "type": "string",
          "minLength": 1
        },
        "exit_code": {
          "type": "integer",
          "minimum": 0,
          "maximum": 255
        }
      },
      "additionalProperties": false
    },
    "outcome": {
      "type": "object",
      "required": ["state", "finding_count", "by_severity"],
      "properties": {
        "state": {
          "type": "string",
          "enum": ["clean", "findings", "tool_error"]
        },
        "finding_count": {
          "type": "integer",
          "minimum": 0
        },
        "by_severity": {
          "type": "object",
          "required": ["critical", "high", "medium", "low", "unknown"],
          "properties": {
            "critical": {"type": "integer", "minimum": 0},
            "high": {"type": "integer", "minimum": 0},
            "medium": {"type": "integer", "minimum": 0},
            "low": {"type": "integer", "minimum": 0},
            "unknown": {"type": "integer", "minimum": 0}
          },
          "additionalProperties": false
        }
      },
      "additionalProperties": false
    },
    "findings": {
      "type": "array",
      "items": {
        "type": "object",
        "required": [
          "advisory_id",
          "package",
          "severity",
          "patched_versions"
        ],
        "properties": {
          "advisory_id": {
            "type": "string",
            "pattern": "^RUSTSEC-\\d{4}-\\d{4}$"
          },
          "package": {
            "type": "object",
            "required": ["name", "version"],
            "properties": {
              "name": {"type": "string", "minLength": 1},
              "version": {"type": "string", "minLength": 1}
            },
            "additionalProperties": false
          },
          "severity": {
            "type": "string",
            "enum": ["critical", "high", "medium", "low", "unknown"]
          },
          "title": {
            "type": "string",
            "minLength": 1
          },
          "url": {
            "type": "string",
            "format": "uri",
            "minLength": 1
          },
          "patched_versions": {
            "type": "array",
            "items": {"type": "string", "minLength": 1}
          }
        },
        "additionalProperties": false
      }
    }
  },
  "additionalProperties": false
}
